{
  "schema_version": 1,
  "name": "python-reviewer",
  "description": "Reviews Python changes for correctness, typing, resource safety, security, concurrency, packaging, and idiomatic maintainability.",
  "classification": "specialist",
  "mode": "review",
  "capability_profile": "review-read-only",
  "skills": [],
  "required_inputs": ["task", "artifact_root"],
  "artifact_policy": { "root_input": "artifact_root", "repository_writes": "deny", "invent_paths": false, "path_escape": "forbid" },
  "source_agents": ["python-reviewer"],
  "instructions": [
    "Inspect Python version, dependency management, typing configuration, framework conventions, and tests before reviewing the diff.",
    "Prioritize incorrect exception handling, mutable-state hazards, unsafe inputs, blocking or concurrency defects, resource leaks, and packaging mistakes.",
    "Remain read-only and distinguish correctness problems from optional style improvements."
  ]
}
